{
  "$schema": "https://json-schema.org/draft/2020-12/schema",
  "$id": "https://octorato/schemas/skill-manifest-v1.json",
  "title": "Octorato Skill Manifest",
  "description": "Machine-readable manifest for a distributable package (Milestone M5 Distribution; v8 PACKAGE primitive). Lets a stranger safely install a versioned skill: identity (name), vintage (semver version), terms (license), the privileged actions it declares (capabilities), the hash of its own tree (tree_sha256) and the detached signature over this file (signature). additionalProperties is false so typos surface instead of being silently ignored. Schema evolution happens via v1 → v2 (new $id path).",
  "type": "object",
  "additionalProperties": false,
  "required": ["name", "version", "license"],
  "$comment": "telemetry is an arm field: when kind is not arm (a skill, or no kind, which means skill), telemetry is refused by the else branch.",
  "if": {
    "properties": { "kind": { "const": "arm" } },
    "required": ["kind"]
  },
  "else": {
    "properties": { "telemetry": false }
  },
  "properties": {
    "kind": {
      "description": "What this manifest describes. 'skill' is signed, vendored under skills/vendor/<name> and symlinked into the discovery path. 'arm' is a client repo: validated and registered, never signed (an arm is the operator's own repo, so a signature would be the operator signing to himself). Absent means skill.",
      "type": "string",
      "enum": ["skill", "arm"]
    },
    "tree_sha256": {
      "description": "sha256 over every file in the package except this manifest and its detached signature, feeding '<posix relpath>\\u0000<sha256 of the bytes>\\u0000' per file in sorted path order. Computed and checked by scripts/octo_pkg.py. Required for an installable skill package; absent on an in-repo manifest, whose tree changes on every edit.",
      "type": "string",
      "pattern": "^[0-9a-f]{64}$"
    },
    "signature": {
      "description": "Metadata about the DETACHED signature over this manifest, which lives beside it in skill.json.sig. The bytes are never inlined here: the signature covers this file, so it cannot be inside it. Because the manifest carries tree_sha256, a valid signature over the manifest is a signature over the tree.",
      "type": "object",
      "additionalProperties": false,
      "properties": {
        "namespace": {
          "description": "ssh-keygen -Y namespace the signature was made under. Always octorato-pkg.",
          "type": "string",
          "const": "octorato-pkg"
        },
        "signer": {
          "description": "Allowed-signers principal expected to verify it, e.g. octorato-release.",
          "type": "string",
          "minLength": 1,
          "maxLength": 128
        },
        "file": {
          "description": "Relative path of the detached signature. Always skill.json.sig.",
          "type": "string",
          "const": "skill.json.sig"
        }
      }
    },
    "telemetry": {
      "description": "Arm only: what this arm allows to leave it as telemetry. Absent, or present without `export`, means the same as `export: deny`.",
      "type": "object",
      "additionalProperties": false,
      "properties": {
        "export": {
          "description": "Export_Policy of the arm (v11 tracing spec, AC-09 and AC-16). `deny` (the template default): no trace of a session in this arm is started for a third-party trace service; scripts/g__wrap__export-guard.py never spawns the upstream tracing hook. `allow`: the upstream tracing hook runs for sessions in this arm, with its redaction on. Exactly these two strings; any other value is read by the guard as deny. Only the operator flips it to allow: scripts/g__pretool__export-flip.py denies an agent write that does.",
          "type": "string",
          "enum": ["deny", "allow"]
        }
      }
    },
    "name": {
      "description": "Skill slug — lowercase kebab-case, matches the skills/<name>/ directory.",
      "type": "string",
      "pattern": "^[a-z0-9]+(-[a-z0-9]+)*$",
      "minLength": 2,
      "maxLength": 64
    },
    "version": {
      "description": "Semantic version (semver 2.0.0). Required so installs are reproducible and upgradeable.",
      "type": "string",
      "pattern": "^(0|[1-9]\\d*)\\.(0|[1-9]\\d*)\\.(0|[1-9]\\d*)(?:-((?:0|[1-9]\\d*|\\d*[a-zA-Z-][0-9a-zA-Z-]*)(?:\\.(?:0|[1-9]\\d*|\\d*[a-zA-Z-][0-9a-zA-Z-]*))*))?(?:\\+([0-9a-zA-Z-]+(?:\\.[0-9a-zA-Z-]+)*))?$"
    },
    "license": {
      "description": "SPDX license identifier (e.g. MIT, Apache-2.0, AGPL-3.0-only) or 'proprietary'.",
      "type": "string",
      "minLength": 1,
      "maxLength": 64
    },
    "description": {
      "description": "One-line summary, mirrors the skill's front-matter description.",
      "type": "string",
      "maxLength": 1024
    },
    "capabilities": {
      "description": "Privileged tools/actions the skill declares it needs (from the capability vocabulary). Lets an installer reason about the blast radius before trusting the skill.",
      "type": "array",
      "items": {
        "type": "string",
        "enum": [
          "Bash", "Read", "Write", "Edit", "MultiEdit", "NotebookEdit",
          "Grep", "Glob", "Agent", "Task", "WebFetch", "WebSearch",
          "Skill", "TodoWrite"
        ]
      },
      "uniqueItems": true
    },
    "dependencies": {
      "description": "Other skills this skill requires, keyed by skill slug → semver range string.",
      "type": "object",
      "additionalProperties": {
        "type": "string",
        "minLength": 1
      },
      "propertyNames": {
        "pattern": "^[a-z0-9]+(-[a-z0-9]+)*$"
      }
    },
    "author": {
      "description": "Optional author/maintainer attribution.",
      "type": "string",
      "maxLength": 256
    },
    "homepage": {
      "description": "Optional source/documentation URL, http(s) only. The scheme allowlist is the pattern, not the format: 'format' is an annotation a validator only enforces when the optional format extras are installed, and even where they are, 'javascript:alert(1)' is a well-formed URI that would pass. The pattern is what keeps a manifest from carrying a link a reader can be handed.",
      "type": "string",
      "format": "uri",
      "pattern": "^https?://[^\\s]+$"
    }
  }
}
