{
  "kind": "skill",
  "name": "playwright",
  "version": "1.0.0",
  "license": "Apache-2.0",
  "description": "Use when the task requires automating a real browser from the terminal (navigation, form filling, snapshots, screenshots, data extraction, UI-flow debugging) via `playwright-cli` or the bundled wrapper script."
}
