{
  "kind": "skill",
  "name": "durable-objects",
  "version": "1.0.0",
  "license": "Apache-2.0",
  "description": "Create and review Cloudflare Durable Objects. Use when building stateful coordination (chat rooms, multiplayer games, booking systems), implementing RPC methods, SQLite storage, alarms, WebSockets, or reviewing DO code for best practices. Covers Workers integration, wrangler config, and testing with Vitest. Biases towards retrieval from Cloudflare docs over pre-trained knowledge."
}
