{
  "kind": "skill",
  "name": "sample-package",
  "version": "1.0.0",
  "license": "MIT",
  "description": "Sample package used by the PACKAGE selftest.",
  "tree_sha256": "0f00d40ce224e2c2173d7c3b99960af22940689e5bf92bbce93c1839f815c49a",
  "signature": {
    "namespace": "octorato-pkg",
    "signer": "octorato-release",
    "file": "skill.json.sig"
  }
}
