{
  "kind": "skill",
  "name": "pre-merge-qa-gate",
  "version": "1.0.0",
  "license": "MIT",
  "description": "Before merging a PR that touches production code, dispatch a QA specialist agent against an explicit test/user-case spec for the diff, then merge directly, pinned to the commit it reviewed. Build-passes ≠ correct. The merge is the mechanism, not the gate."
}
