{
  "kind": "skill",
  "name": "agent-browser",
  "version": "1.0.0",
  "license": "MIT",
  "description": "Rust-native browser automation CLI for agents, no Playwright. Navigates, fills forms, clicks, takes screenshots and extracts data. Triggers on 'abre el sitio', 'toma screenshot', 'prueba esta web', 'QA'."
}
