{
  "kind": "skill",
  "name": "security-best-practices",
  "version": "1.0.0",
  "license": "Apache-2.0",
  "description": "Perform language and framework specific security best-practice reviews and suggest improvements. Trigger only when the user explicitly requests security best practices guidance, a security review/report, or secure-by-default coding help. Trigger only for supported languages (python, javascript/typescript, go). Do not trigger for general code review, debugging, or non-security tasks."
}
